<?xml version="1.0" encoding="UTF-8"?>
<!--

    Copyright (C) 2014 The Holodeck B2B Team, Sander Fieten

    This program is free software: you can redistribute it and/or modify
    it under the terms of the GNU General Public License as published by
    the Free Software Foundation, either version 3 of the License, or
    (at your option) any later version.

    This program is distributed in the hope that it will be useful,
    but WITHOUT ANY WARRANTY; without even the implied warranty of
    MERCHANTABILITY or FITNESS FOR A PARTICULAR PURPOSE.  See the
    GNU General Public License for more details.

    You should have received a copy of the GNU General Public License
    along with this program.  If not, see <http://www.gnu.org/licenses/>.

-->
<!-- Pull configuration for testing

Contains both the default puller als well as specific pullers. The specific pullers contain one or more P-Modes
-->
<pulling xmlns="http://holodeck-b2b.org/schemas/2014/05/pullconfiguration"
 xmlns:xsi="http://www.w3.org/2001/XMLSchema-instance"
 xsi:schemaLocation="http://holodeck-b2b.org/schemas/2014/05/pullconfiguration ../../../main/resources/xsd/pullingconfig.xsd"
 refresh="600">
    <default interval="1491039197"/>
    <pull interval="1985496162">
        <pmodes>
            <pmode id="LO7.wrubhpHfZ9Kzr3buPpHMVI"/>
        </pmodes>
    </pull>
    <pull interval="1622097273">
        <pmodes>
            <pmode id="INyEfTQuibb8t"/>
            <pmode id="Qw1hfHh"/>
        </pmodes>
    </pull>
</pulling>
